Sheet: Date
A3: Compare dates (using DAYS)
A4: Data A: | B4: 2021-01-25
A5: Data B: | B5: 2021-03-15
A6: Is A before B: | B6: of:=DAYS([.$B$5];[.$B$4])>0 -> true
A7: Is A after B: | B7: of:=DAYS([.$B$5];[.$B$4])<0 -> false
A8: Is A before A: | B8: of:=DAYS([.$B$4];[.$B$4])>0 -> false
A9: Is A before or equal A: | B9: of:=DAYS([.$B$4];[.$B$4])>=0 -> true
A11: Compare dates (using =,<,>)
A12: Data A: | B12: 2021-01-25
A13: Data B: | B13: 2021-03-15
A14: Is A before B: | B14: of:=[.$B$13]>[.$B$12] -> true
A15: Is A after B: | B15: of:=[.$B$13]<[.$B$12] -> false
A16: Is A before A: | B16: of:=[.$B$12]>[.$B$12] -> false
A17: Is A before or equal A: | B17: of:=[.$B$12]>=[.$B$12] -> true

Sheet: SUMIF
A4: Date | B4: Value
A5: 2022-01-01 | B5: 7
A6: 2022-01-02 | B6: 3
A7: 2022-01-03 | B7: 8
A8: 2022-01-04 | B8: 1
A9: 2022-01-05 | B9: 2
A10: 2022-01-06 | B10: 9
A11: 2022-01-07 | B11: 6
A12: 2022-01-08 | B12: 4
A13: 2022-01-09 | B13: 5
A16: Sum before Date A (including)
A17: Date A: | B17: 2022-01-05
A18: Exp sum: | B18: of:=SUM([.B5:.B9]) -> 21
A19: Act sum: | B19: of:=SUMIF([.A5:.A13];"<="&[.B17];[.B5:.B13]) -> 21

Sheet: Currency format
A1: Currency format
A3: Positive: | C3: 1234.56
A4: Negative: | C4: -1234.56
A6: USD | B6: + | C6: of:=POSITIVE -> 1234.56 | D6: of:=POSITIVE -> 1234.56
B7: - | C7: of:=NEGATIVE -> -1234.56 | D7: of:=NEGATIVE -> -1234.56
A8: EUR | B8: + | C8: of:=POSITIVE -> 1234.56 | D8: of:=POSITIVE -> 1234.56 | E8: of:=POSITIVE -> 1234.56
B9: - | C9: of:=NEGATIVE -> -1234.56 | D9: of:=NEGATIVE -> -1234.56 | E9: of:=NEGATIVE -> -1234.56
A10: RUB | B10: + | C10: of:=POSITIVE -> 1234.56 | D10: of:=POSITIVE -> 1234.56 | E10: of:=POSITIVE -> 1234.56 | F10: of:=POSITIVE -> 1234.56 | G10: of:=POSITIVE -> 1234.56 | H10: of:=POSITIVE -> 1234.56
B11: - | C11: of:=NEGATIVE -> -1234.56 | D11: of:=NEGATIVE -> -1234.56 | E11: of:=NEGATIVE -> -1234.56 | F11: of:=NEGATIVE -> -1234.56 | G11: of:=NEGATIVE -> -1234.56 | H11: of:=NEGATIVE -> -1234.56
A12: PHP | B12: + | C12: of:=POSITIVE -> 1234.56 | D12: of:=POSITIVE -> 1234.56
B13: - | C13: of:=NEGATIVE -> -1234.56 | D13: of:=NEGATIVE -> -1234.56
A14: TRY | B14: + | C14: of:=POSITIVE -> 1234.56 | D14: of:=POSITIVE -> 1234.56
B15: - | C15: of:=NEGATIVE -> -1234.56 | D15: of:=NEGATIVE -> -1234.56
A16: THB | B16: + | C16: of:=POSITIVE -> 1234.56 | D16: of:=POSITIVE -> 1234.56
B17: - | C17: of:=NEGATIVE -> -1234.56 | D17: of:=NEGATIVE -> -1234.56
A18: EGP | B18: + | C18: of:=POSITIVE -> 1234.56 | D18: of:=POSITIVE -> 1234.56
B19: - | C19: of:=NEGATIVE -> -1234.56 | D19: of:=NEGATIVE -> -1234.56

Sheet: Corrency conversion
A2: USD/RUB | B2: 68.66
A3: USD/EUR | B3: 0.92
A5: Using IF function
A6: Currency | B6: Value | C6: Value USD
A7: RUB | B7: 10000 | C7: of:=IF([.A7]="RUB";[.B7]/[.$B$2];IF([.A7]="EUR";[.B7]*[.$B$3];[.B7])) -> 145.645208272648
A8: EUR | B8: 3000 | C8: of:=IF([.A8]="RUB";[.B8]*[.$B$2];IF([.A8]="EUR";[.B8]/[.$B$3];[.B8])) -> 3260.86956521739
A9: USD | B9: 4000 | C9: of:=IF([.A9]="RUB";[.B9]*[.$B$2];IF([.A9]="EUR";[.B9]*[.$B$3];[.B9])) -> 4000
A11: Using IFS function
A12: Currency | B12: Value | C12: Value USD
A13: RUB | B13: 10000 | C13: of:=COM.MICROSOFT.IFS([.A13]="RUB";[.B13]/[.$B$2];[.A13]="EUR";[.B13]*[.$B$3];[.A13]="USD";[.B13]) -> 145.645208272648
A14: EUR | B14: 3000 | C14: of:=COM.MICROSOFT.IFS([.A14]="RUB";[.B14]/[.$B$2];[.A14]="EUR";[.B14]*[.$B$3];[.A14]="USD";[.B14]) -> 2760
A15: USD | B15: 4000 | C15: of:=COM.MICROSOFT.IFS([.A15]="RUB";[.B15]/[.$B$2];[.A15]="EUR";[.B15]*[.$B$3];[.A15]="USD";[.B15]) -> 4000